{
  "artifact_dir": "/lustre/orion/ast207/proj-shared/dfielding/PIC/runs/f2_multirank_runtime_metadata/500fa268-180f-4a71-8cf6-b5c7492939e4",
  "campaign": "f2_multirank_runtime_metadata",
  "clean_candidate_manifest_path": "/lustre/orion/ast207/proj-shared/dfielding/PIC/clean_candidates/31be2cd6-19db-4246-9857-06fc2f523c19/clean_candidate_manifest.json",
  "clean_candidate_manifest_sha256": "3174515d1578f0310e8ce4b0bf214050f8b4d95ff4af3c694b44eb466b7dff41",
  "control_plane_inventory": [
    {
      "path": "clean_candidate.schema.json",
      "sha256": "230b107ed048065b1269d6485e45614dce694e461f0c4b5798ebc2b6e638661b"
    },
    {
      "path": "control_plane.schema.json",
      "sha256": "f9629c810d3c728c1e6837e55a3b58f572df64241cfbaf3e2a4ae95cda6d47ad"
    },
    {
      "path": "control_plane_common.py",
      "sha256": "f9fe83334d1cee5cb0ffc107314fbe1adfe873d445c6ba63bf4a21713e696050"
    },
    {
      "path": "create_clean_candidate_freeze.py",
      "sha256": "dbc0b256ac60098c83389b9997726fff9f4c157b3ad0517b377af940e8dc814b"
    },
    {
      "path": "create_pre_submit_manifest.py",
      "sha256": "7ca6c4009e3d8c912393dc8ddfa49efcc2d40a8e7836aee3586d34b35a4d20df"
    },
    {
      "path": "frontier_pic_environment.sh",
      "sha256": "7ff6cff3e263e8b4552bcbac1d5b55a85264a2a7af5565bbc9856584e35402c1"
    },
    {
      "path": "initialize_frontier_ledger.py",
      "sha256": "9f2add84d80e9fc487e6655c2280454507e728781169113390ecc152867fd5a5"
    },
    {
      "path": "launch_trampoline.py",
      "sha256": "2d3b9f1db9c30e402c217620ba40f6f7edac6356b184b0746a8d0972002f397f"
    },
    {
      "path": "launch_with_frontier_profile.sh",
      "sha256": "625d4fe1e7d7cfa5a9782b66ae266230da42e17e593f3501d08ab4d045af4a34"
    },
    {
      "path": "ledger.py",
      "sha256": "1dba994420a0defd83f73979ec85c2d3d14709a6d4afbb27569781640d45c42f"
    },
    {
      "path": "promote_active_policy.py",
      "sha256": "e8d6e527d54d38068e3eee4c6ed52570310c6316095df95a8ffcdb0098cfa3a5"
    },
    {
      "path": "reconcile_frontier_job.py",
      "sha256": "cfd0080fbe1a9885250899046eee1e7d3fdfdb17f6a81e179f85f0265fb80d69"
    },
    {
      "path": "run_installed_control_plane_job.sh",
      "sha256": "0784f29d3c9f03b9f404efcb19853bd0e6c681568974480d43242578d69291e1"
    },
    {
      "path": "run_control_plane.py",
      "sha256": "cc478aa324ab62c2b93b4684b97067a3ef4fc08dc48698303f12b192db4c8f8f"
    },
    {
      "path": "submit_frontier_job.sh",
      "sha256": "10916e1e59a8890186e2b2dfc8b2aa585ea0c6178df33a1d1334305b65ff0500"
    },
    {
      "path": "terminal_recovery_handoff.py",
      "sha256": "7fbcff2a94fd2c6eac6f689a6199271507aabdbf07cacc52b29abe04283a0813"
    },
    {
      "path": "validate_and_reserve_frontier_job.py",
      "sha256": "40b1b9064a8e8e95d3bef64d8f28ec0ccdb1562a693000acb8ff9d6eb51058a0"
    },
    {
      "path": "verify_compute_node_snapshot.py",
      "sha256": "57e94e5ba0e390d005a2da9ebff2a0e97eca794e4ac111ed82b77433d38a7dea"
    },
    {
      "path": "write_orion_build_profile.py",
      "sha256": "56d845a4c8b322400f1b43c597cdc8bfbe1bd4c0606b59bf7637d0eba768a0df"
    }
  ],
  "control_plane_version": "4ccde8dfe557fbb6450c15b2ee68d41d2ac0711d5d56d79e775fa75178177bd3",
  "evidence_class": "frontier_f2_clean_candidate_multirank_runtime_metadata",
  "git_commit": "4cceb5d4e9b78e7058d7a696653d56604f94bd53",
  "job_script_executable_env": "PIC_EXECUTABLE",
  "launch_contract": {
    "actions": [
      {
        "action_id": "f2-runtime-metadata",
        "arguments": [
          {
            "literal": "-i"
          },
          {
            "snapshot_role": "input-deck"
          },
          {
            "literal": "-d"
          },
          {
            "artifact_directory": "output"
          },
          {
            "literal": "job/basename=f2_multirank_runtime_metadata"
          },
          {
            "literal": "mesh/nx1=8"
          },
          {
            "literal": "mesh/nx2=8"
          },
          {
            "literal": "mesh/nx3=8"
          },
          {
            "literal": "time/nlim=1"
          }
        ],
        "kind": "athena",
        "resources": {
          "cpus_per_task": 7,
          "gpu_bind": "closest",
          "gpus_per_task": 1,
          "nodes": 1,
          "tasks": 8
        },
        "stderr_artifact": "athena_stderr.txt",
        "stdout_artifact": "athena_stdout.txt"
      }
    ],
    "executor": "trusted_trampoline_athena_argv_v1",
    "post_actions": [
      {
        "action_id": "require-runtime-metadata-stdout",
        "artifact": "athena_stdout.txt",
        "kind": "artifact_nonempty"
      },
      {
        "action_id": "sha-runtime-metadata-stdout",
        "artifact": "athena_stdout.txt",
        "kind": "artifact_sha256",
        "output_artifact": "athena_stdout.sha256"
      }
    ],
    "pre_actions": [],
    "schema_version": 1
  },
  "physical_mode": "extended_mhd_pic_parser_contract",
  "pic_root": "/lustre/orion/ast207/proj-shared/dfielding/PIC",
  "qos_selection_reason": "debug_available",
  "queue_snapshot_sha256": "057fe8ea530de2cc544e7ddff3e5415612ce6031ceb7245e3b08b8588ff7618c",
  "registered_science_authorization_id": "f2-parser-multirank-runtime-metadata-v2",
  "registered_short_nonproduction": true,
  "schema_version": 1,
  "selected_qos": "debug",
  "site_policy_checked_utc": "2026-05-30T23:45:57Z",
  "snapshot_files": [
    {
      "path": "/lustre/orion/ast207/proj-shared/dfielding/PIC/manifests/f2_multirank_runtime_metadata/500fa268-180f-4a71-8cf6-b5c7492939e4/snapshot/pre_submit_config.json",
      "role": "pre-submit-config",
      "sha256": "9968266b7f65daaa64275897ad5e3a883d2309e87f3562e7316e9a0b2dde6c9d",
      "source_path": "/lustre/orion/ast207/proj-shared/dfielding/PIC/jobs/f2_multirank_runtime_metadata/500fa268-180f-4a71-8cf6-b5c7492939e4/pre_submit_config.json",
      "source_sha256": "9968266b7f65daaa64275897ad5e3a883d2309e87f3562e7316e9a0b2dde6c9d"
    },
    {
      "path": "/lustre/orion/ast207/proj-shared/dfielding/PIC/manifests/f2_multirank_runtime_metadata/500fa268-180f-4a71-8cf6-b5c7492939e4/snapshot/clean_candidate_manifest.json",
      "role": "clean-candidate-manifest",
      "sha256": "3174515d1578f0310e8ce4b0bf214050f8b4d95ff4af3c694b44eb466b7dff41",
      "source_path": "/lustre/orion/ast207/proj-shared/dfielding/PIC/clean_candidates/31be2cd6-19db-4246-9857-06fc2f523c19/clean_candidate_manifest.json",
      "source_sha256": "3174515d1578f0310e8ce4b0bf214050f8b4d95ff4af3c694b44eb466b7dff41"
    },
    {
      "path": "/lustre/orion/ast207/proj-shared/dfielding/PIC/manifests/f2_multirank_runtime_metadata/500fa268-180f-4a71-8cf6-b5c7492939e4/snapshot/job.sh",
      "role": "job-script",
      "sha256": "e825d2c153b789706d2c293d04a34e1db08b0dc2a8e0043d1e88183f0b029b87",
      "source_path": "/autofs/nccs-svm1_home2/dfielding/athenak-pic/tst/publication/frontier_f2_structured_multirank_runtime_metadata_job.sh",
      "source_sha256": "e825d2c153b789706d2c293d04a34e1db08b0dc2a8e0043d1e88183f0b029b87"
    },
    {
      "path": "/lustre/orion/ast207/proj-shared/dfielding/PIC/manifests/f2_multirank_runtime_metadata/500fa268-180f-4a71-8cf6-b5c7492939e4/snapshot/athena",
      "role": "executable",
      "sha256": "bea2a418faf582e0b7e8a2830494fa156ddddb18763dde21d344a4cba14a60d8",
      "source_path": "/lustre/orion/ast207/proj-shared/dfielding/PIC/clean_candidates/31be2cd6-19db-4246-9857-06fc2f523c19/athena",
      "source_sha256": "bea2a418faf582e0b7e8a2830494fa156ddddb18763dde21d344a4cba14a60d8"
    },
    {
      "path": "/lustre/orion/ast207/proj-shared/dfielding/PIC/manifests/f2_multirank_runtime_metadata/500fa268-180f-4a71-8cf6-b5c7492939e4/snapshot/pic_parser_contract_guards.athinput",
      "role": "input-deck",
      "sha256": "e14ac149dc3f8c6fb3d5400f6e330063e6f72f2ed2f54691ade8c65ce5173a45",
      "source_path": "/autofs/nccs-svm1_home2/dfielding/athenak-pic/inputs/tests/pic_parser_contract_guards.athinput",
      "source_sha256": "e14ac149dc3f8c6fb3d5400f6e330063e6f72f2ed2f54691ade8c65ce5173a45"
    },
    {
      "path": "/lustre/orion/ast207/proj-shared/dfielding/PIC/manifests/f2_multirank_runtime_metadata/500fa268-180f-4a71-8cf6-b5c7492939e4/snapshot/frontier_pic_environment.sh",
      "role": "environment-profile",
      "sha256": "7ff6cff3e263e8b4552bcbac1d5b55a85264a2a7af5565bbc9856584e35402c1",
      "source_path": "/lustre/orion/ast207/proj-shared/dfielding/PIC/control_plane/4ccde8dfe557fbb6450c15b2ee68d41d2ac0711d5d56d79e775fa75178177bd3/frontier_pic_environment.sh",
      "source_sha256": "7ff6cff3e263e8b4552bcbac1d5b55a85264a2a7af5565bbc9856584e35402c1"
    },
    {
      "path": "/lustre/orion/ast207/proj-shared/dfielding/PIC/manifests/f2_multirank_runtime_metadata/500fa268-180f-4a71-8cf6-b5c7492939e4/snapshot/timeout_margin.json",
      "role": "timeout-margin",
      "sha256": "36f2b3d59280a1441673e62df9db55b20e11374e19609fdd617ff798f720adf6",
      "source_path": "/lustre/orion/ast207/proj-shared/dfielding/PIC/jobs/f2_multirank_runtime_metadata/500fa268-180f-4a71-8cf6-b5c7492939e4/timeout_margin.json",
      "source_sha256": "36f2b3d59280a1441673e62df9db55b20e11374e19609fdd617ff798f720adf6"
    },
    {
      "path": "/lustre/orion/ast207/proj-shared/dfielding/PIC/manifests/f2_multirank_runtime_metadata/500fa268-180f-4a71-8cf6-b5c7492939e4/snapshot/verify_compute_node_snapshot.py",
      "role": "compute-node-verifier",
      "sha256": "57e94e5ba0e390d005a2da9ebff2a0e97eca794e4ac111ed82b77433d38a7dea",
      "source_path": "/lustre/orion/ast207/proj-shared/dfielding/PIC/control_plane/4ccde8dfe557fbb6450c15b2ee68d41d2ac0711d5d56d79e775fa75178177bd3/verify_compute_node_snapshot.py",
      "source_sha256": "57e94e5ba0e390d005a2da9ebff2a0e97eca794e4ac111ed82b77433d38a7dea"
    },
    {